{
  "schemaVersion": 1,
  "pilot": {
    "id": "heavyvehiclebook",
    "title": {
      "en": "HeavyVehicleBook",
      "ko": "HeavyVehicleBook"
    },
    "collection": {
      "en": "Little Explorers",
      "ko": "꼬마 탐험가"
    },
    "status": "editorial-pilot",
    "publicationStatus": "unpublished",
    "description": {
      "en": "A proposed family story collection about large work vehicles, the people who use them, and the places they help shape. These bilingual drafts are editorial previews, not a released book.",
      "ko": "큰 작업 차량과 이를 다루는 사람들, 차량이 함께 만들어 가는 장소를 다루는 가족 이야기 모음 기획입니다. 이중 언어 원고는 편집용 미리보기이며 출판된 책이 아닙니다."
    },
    "readerNote": {
      "en": "A grown-up may read aloud, children may listen or leave at any time, and every optional prompt or illustration detail can be skipped.",
      "ko": "보호자가 소리 내어 읽고 아이는 듣다가 언제든 멈출 수 있습니다. 선택형 질문이나 그림의 작은 요소는 모두 건너뛸 수 있습니다."
    },
    "rightsNotice": {
      "en": "The English and Korean story prose is a public editorial preview with no reuse license granted. A separate content license must be selected before publication. The authored SVG previews are generated by the site code and remain under its separate MIT software license; that license does not cover story prose.",
      "ko": "영어·한국어 이야기 원고는 공개 편집 미리보기이며 재사용 라이선스를 부여하지 않습니다. 출판 전에 별도의 콘텐츠 라이선스를 정해야 합니다. 직접 만든 SVG 미리보기 그림은 사이트 코드로 생성되며 별도의 MIT 소프트웨어 라이선스를 따릅니다. 해당 라이선스는 이야기 원고에는 적용되지 않습니다."
    }
  },
  "interests": [
    {
      "id": "cars-and-transport",
      "label": {
        "en": "Cars & transport",
        "ko": "자동차와 교통"
      },
      "description": {
        "en": "Explore vehicles that carry people and the ways they move through shared places.",
        "ko": "사람을 태우는 탈것과 함께 쓰는 길에서 움직이는 방식을 살펴봐요."
      }
    },
    {
      "id": "heavy-vehicles",
      "label": {
        "en": "Heavy vehicles",
        "ko": "대형 작업 차량"
      },
      "description": {
        "en": "Notice dump trucks, excavators, cranes, and other large work vehicles from a safe distance.",
        "ko": "안전한 거리에서 덤프트럭·굴착기·크레인 같은 대형 작업 차량을 살펴봐요."
      }
    },
    {
      "id": "trains-planes-ships",
      "label": {
        "en": "Trains, planes & ships",
        "ko": "기차·비행기·배"
      },
      "description": {
        "en": "Compare vehicles that travel on rails, through the air, or across water.",
        "ko": "철길·하늘·물 위를 다니는 탈것을 비교해 봐요."
      }
    },
    {
      "id": "robots-machines",
      "label": {
        "en": "Robots & machines",
        "ko": "로봇과 기계"
      },
      "description": {
        "en": "Explore how different machines move, respond, and help people with a task.",
        "ko": "여러 기계가 움직이고 반응하며 사람의 일을 돕는 방식을 살펴봐요."
      }
    },
    {
      "id": "animals-wildlife",
      "label": {
        "en": "Animals & wildlife",
        "ko": "동물과 야생 생물"
      },
      "description": {
        "en": "Meet animals, their body features, habitats, and everyday needs.",
        "ko": "동물의 생김새와 서식지, 일상에 필요한 것을 만나요."
      }
    },
    {
      "id": "dinosaurs-prehistory",
      "label": {
        "en": "Dinosaurs & prehistory",
        "ko": "공룡과 선사 시대"
      },
      "description": {
        "en": "Use fossils and evidence to imagine life long ago.",
        "ko": "화석과 증거를 바탕으로 오래전 생물을 상상해 봐요."
      }
    },
    {
      "id": "ocean",
      "label": {
        "en": "Ocean",
        "ko": "바다"
      },
      "description": {
        "en": "Explore ocean places, changing water, and the life found there.",
        "ko": "바닷속 환경과 변하는 물, 그곳에 사는 생물을 살펴봐요."
      }
    },
    {
      "id": "insects-nature",
      "label": {
        "en": "Insects & nature",
        "ko": "곤충과 자연"
      },
      "description": {
        "en": "Notice small animals, plants, weather, and seasonal change.",
        "ko": "작은 동물과 식물, 날씨와 계절의 변화를 살펴봐요."
      }
    },
    {
      "id": "space",
      "label": {
        "en": "Space",
        "ko": "우주"
      },
      "description": {
        "en": "Explore the Moon, planets, stars, and the sky beyond Earth.",
        "ko": "달·행성·별과 지구 너머의 하늘을 살펴봐요."
      }
    },
    {
      "id": "weather-earth",
      "label": {
        "en": "Weather & Earth",
        "ko": "날씨와 지구"
      },
      "description": {
        "en": "Watch wind, rain, soil, rocks, and changing surroundings.",
        "ko": "바람·비·흙·바위처럼 달라지는 주변을 살펴봐요."
      }
    },
    {
      "id": "human-body-health",
      "label": {
        "en": "Human body & health",
        "ko": "인체와 건강"
      },
      "description": {
        "en": "Notice body senses, movement, rest, and ways to care for health.",
        "ko": "몸의 감각과 움직임, 휴식과 건강을 돌보는 방법을 살펴봐요."
      }
    },
    {
      "id": "stories-cultures-history",
      "label": {
        "en": "Stories, cultures & history",
        "ko": "이야기·문화·역사"
      },
      "description": {
        "en": "Listen to stories and meet people, places, and events across time.",
        "ko": "이야기를 듣고 여러 시대의 사람과 장소, 사건을 만나요."
      }
    },
    {
      "id": "colors-and-counting",
      "label": {
        "en": "Colors and counting",
        "ko": "색과 세기"
      },
      "description": {
        "en": "Spot colors, count things in a picture, and notice a simple pattern.",
        "ko": "그림 속 색을 찾고, 수를 세고, 간단한 규칙을 살펴봐요."
      }
    },
    {
      "id": "shapes-and-sorting",
      "label": {
        "en": "Shapes and sorting",
        "ko": "모양과 분류"
      },
      "description": {
        "en": "Compare shapes and sizes, then notice how people organize materials.",
        "ko": "모양과 크기를 비교하고 사람들이 재료를 정리하는 모습을 살펴봐요."
      }
    },
    {
      "id": "size-and-direction",
      "label": {
        "en": "Size and direction",
        "ko": "크기와 방향"
      },
      "description": {
        "en": "Explore big and small, high and low, near and far.",
        "ko": "크고 작은 것, 높고 낮은 곳, 가깝고 먼 곳을 살펴봐요."
      }
    }
  ],
  "themes": [
    {
      "id": "three-trucks-for-garden",
      "title": {
        "en": "Three trucks for the garden",
        "ko": "정원으로 온 세 대의 트럭"
      },
      "description": {
        "en": "Count a red, yellow, and blue dump truck as a crew prepares a smooth path to the neighborhood garden.",
        "ko": "작업팀이 동네 정원으로 가는 길을 준비하는 동안 빨강·노랑·파랑 덤프트럭 세 대를 세어 봐요."
      },
      "interestIds": [
        "heavy-vehicles",
        "cars-and-transport",
        "weather-earth",
        "colors-and-counting"
      ],
      "storyId": "three-trucks-and-garden-path",
      "conceptIds": [
        "math-preschool-quantity-and-pattern",
        "arts-preschool-materials-and-sound",
        "computing-preschool-tools-and-cause"
      ]
    },
    {
      "id": "shapes-in-garden",
      "title": {
        "en": "Shapes in the garden",
        "ko": "정원에 모인 모양들"
      },
      "description": {
        "en": "An excavator prepares the ground while a crew sorts round, square, and triangle garden markers into a repeating design.",
        "ko": "굴착기가 땅을 준비하고 작업팀은 동그라미·네모·세모 정원 표식을 규칙에 따라 놓아요."
      },
      "interestIds": [
        "heavy-vehicles",
        "robots-machines",
        "insects-nature",
        "shapes-and-sorting"
      ],
      "storyId": "excavator-shape-garden",
      "conceptIds": [
        "math-preschool-quantity-and-pattern",
        "computing-preschool-tools-and-cause",
        "arts-preschool-materials-and-sound"
      ]
    },
    {
      "id": "big-small-up-and-down",
      "title": {
        "en": "Big, small, up, and down",
        "ko": "크고 작게, 위로 아래로"
      },
      "description": {
        "en": "A crane carefully places a broad shade roof above a small garden reading nook, helping children notice direction and size.",
        "ko": "크레인이 작은 정원 책 쉼터 위에 넓은 그늘 지붕을 조심스럽게 놓으며 방향과 크기를 살펴봐요."
      },
      "interestIds": [
        "heavy-vehicles",
        "weather-earth",
        "size-and-direction"
      ],
      "storyId": "crane-big-small-up-down",
      "conceptIds": [
        "math-preschool-quantity-and-pattern",
        "science-preschool-noticing-and-wonder",
        "computing-preschool-tools-and-cause"
      ]
    }
  ],
  "stories": [
    {
      "id": "three-trucks-and-garden-path",
      "title": {
        "en": "The Three Trucks and the Garden Path",
        "ko": "세 대의 트럭과 정원 길"
      },
      "themeId": "three-trucks-for-garden",
      "status": "editorial-draft",
      "description": {
        "en": "Three bright dump trucks bring prepared material for a garden path; Mina counts along from the safe public overlook.",
        "ko": "밝은 색 덤프트럭 세 대가 정원 길에 쓸 재료를 가져옵니다. 미나는 안전한 공공 관람 장소에서 함께 세어 봐요."
      },
      "pages": [
        {
          "id": "a-muddy-turn",
          "sceneId": "truck-problem",
          "text": {
            "en": "After the rain, the garden path had one muddy turn. Mina and Jun could still reach the flowers, but Auntie Hana had to take the longer smooth path around.",
            "ko": "비가 온 뒤 정원 길 한 곳이 진흙투성이가 되었어요. 미나와 준은 꽃밭에 갈 수 있었지만 하나 이모는 조금 더 돌아가더라도 매끈한 길을 이용해야 했지요."
          },
          "illustrationAlt": {
            "en": "Children notice a muddy bend from a public path; a neighbor uses a clear route nearby.",
            "ko": "아이들이 공공 산책로에서 진흙길을 바라보고, 이웃은 옆의 열린 길을 이용합니다."
          },
          "prompt": {
            "en": "What colors do you see on the way to the garden?",
            "ko": "정원으로 가는 길에서 어떤 색을 볼 수 있나요?"
          },
          "optionalDetail": {
            "en": "A ladybug rests on a leaf beside the public path.",
            "ko": "무당벌레 한 마리가 공공 산책로 옆 잎에 앉아 있어요."
          }
        },
        {
          "id": "a-colorful-plan",
          "sceneId": "truck-plan",
          "text": {
            "en": "The grown-up crew made a plan inside the fenced work area. At the public overlook, Mina found three colored signs on the drawing: red, yellow, and blue.",
            "ko": "어른 작업팀은 울타리 안에서 계획을 세웠어요. 공공 관람 장소에서 미나는 도면 속 색깔 표지 세 개를 찾았지요. 빨강, 노랑, 파랑."
          },
          "illustrationAlt": {